{
  "specVersion": "0.1.0",
  "theme": "glass",
  "extends": "modern",
  "components": {
    "button": {
      "variants": {
        "secondary": {
          "base": {
            "root": {
              "fill": "{semantic.color.surfaceElevatedTranslucent}"
            }
          }
        }
      }
    },
    "checkbox": {
      "base": {
        "root": {
          "fill": "{semantic.color.surfaceElevatedTranslucent}"
        }
      }
    },
    "data-grid": {
      "base": {
        "root": {
          "fill": "{semantic.color.surfaceTranslucent}"
        }
      }
    },
    "dialog": {
      "base": {
        "root": {
          "fill": "{semantic.color.surfaceElevatedTranslucent}"
        }
      }
    },
    "input": {
      "base": {
        "root": {
          "fill": "{semantic.color.surfaceElevatedTranslucent}"
        }
      }
    },
    "menu": {
      "base": {
        "popup": {
          "fill": "{semantic.color.surfaceElevatedTranslucent}"
        }
      }
    },
    "navigation": {
      "base": {
        "list": {
          "fill": "{semantic.color.surfaceTranslucent}"
        }
      }
    },
    "panel": {
      "base": {
        "root": {
          "fill": "{semantic.color.surfaceTranslucent}"
        }
      }
    },
    "progress": {
      "variants": {
        "linear": {
          "base": {
            "track": {
              "fill": "{semantic.color.surfaceTranslucent}"
            }
          }
        }
      }
    },
    "radio": {
      "base": {
        "root": {
          "fill": "{semantic.color.surfaceElevatedTranslucent}"
        }
      }
    },
    "select": {
      "base": {
        "root": {
          "fill": "{semantic.color.surfaceElevatedTranslucent}"
        }
      }
    },
    "slider": {
      "base": {
        "track": {
          "fill": "{semantic.color.surfaceTranslucent}"
        },
        "thumb": {
          "fill": "{semantic.color.surfaceElevatedTranslucent}"
        }
      }
    },
    "switch": {
      "base": {
        "root": {
          "fill": "{semantic.color.surfaceTranslucent}"
        }
      }
    },
    "table": {
      "base": {
        "root": {
          "fill": "{semantic.color.surfaceTranslucent}"
        }
      }
    },
    "toast": {
      "base": {
        "root": {
          "fill": "{semantic.color.surfaceElevatedTranslucent}"
        }
      }
    },
    "tooltip": {
      "base": {
        "popup": {
          "fill": "{semantic.color.surfaceElevatedTranslucent}"
        }
      }
    },
    "tree": {
      "base": {
        "root": {
          "fill": "{semantic.color.surfaceTranslucent}"
        }
      }
    }
  }
}
