{
  "specVersion": "0.1.0",
  "theme": "cyberpunk",
  "extends": "basic",
  "components": {
    "button": {
      "base": {
        "root": {
          "radius": "{radius.sm}"
        }
      }
    },
    "checkbox": {
      "base": {
        "root": {
          "fill": "{semantic.color.surface}",
          "border": {
            "color": "{semantic.color.accent}",
            "width": "{border.width.standard}"
          }
        }
      }
    },
    "data-grid": {
      "base": {
        "root": {
          "radius": "{radius.sm}",
          "border": {
            "color": "{semantic.color.accent}",
            "width": "{border.width.standard}"
          }
        }
      }
    },
    "dialog": {
      "base": {
        "root": {
          "fill": "{semantic.color.surfaceElevated}",
          "radius": "{radius.sm}",
          "border": {
            "color": "{semantic.color.focus}",
            "width": "{border.width.standard}"
          },
          "shadow": "{elevation.shadow.medium}"
        }
      }
    },
    "input": {
      "base": {
        "root": {
          "fill": "{semantic.color.surface}",
          "radius": "{radius.sm}",
          "border": {
            "color": "{semantic.color.accent}",
            "width": "{border.width.standard}"
          }
        }
      },
      "states": {
        "hover": {
          "root": {
            "border": {
              "color": "{semantic.color.focus}",
              "width": "{border.width.standard}"
            }
          }
        }
      }
    },
    "menu": {
      "base": {
        "popup": {
          "border": {
            "color": "{semantic.color.accent}",
            "width": "{border.width.standard}"
          }
        },
        "separator": {
          "fill": "{semantic.color.focus}"
        }
      }
    },
    "navigation": {
      "base": {
        "list": {
          "radius": "{radius.sm}",
          "border": {
            "color": "{semantic.color.accent}",
            "width": "{border.width.standard}"
          }
        },
        "item": {
          "radius": "{radius.sm}"
        }
      }
    },
    "panel": {
      "base": {
        "root": {
          "fill": "{semantic.color.surface}",
          "radius": "{radius.sm}",
          "border": {
            "color": "{semantic.color.accent}",
            "width": "{border.width.standard}"
          },
          "shadow": "{elevation.shadow.low}"
        }
      }
    },
    "progress": {
      "variants": {
        "circular": {
          "base": {
            "track": {
              "border": {
                "color": "{semantic.color.focus}",
                "width": "{component.progress.circular.stroke.medium}"
              }
            }
          }
        }
      }
    },
    "radio": {
      "base": {
        "root": {
          "fill": "{semantic.color.surface}",
          "border": {
            "color": "{semantic.color.accent}",
            "width": "{border.width.standard}"
          }
        }
      }
    },
    "select": {
      "base": {
        "root": {
          "fill": "{semantic.color.surface}",
          "radius": "{radius.sm}",
          "border": {
            "color": "{semantic.color.accent}",
            "width": "{border.width.standard}"
          }
        }
      },
      "states": {
        "hover": {
          "root": {
            "border": {
              "color": "{semantic.color.focus}",
              "width": "{border.width.standard}"
            }
          }
        }
      }
    },
    "slider": {
      "base": {
        "track": {
          "fill": "{semantic.color.surface}",
          "border": {
            "color": "{semantic.color.accent}",
            "width": "{border.width.standard}"
          }
        },
        "thumb": {
          "fill": "{semantic.color.surface}",
          "border": {
            "color": "{semantic.color.focus}",
            "width": "{border.width.standard}"
          }
        }
      }
    },
    "switch": {
      "base": {
        "root": {
          "fill": "{semantic.color.surface}",
          "radius": "{radius.sm}",
          "border": {
            "color": "{semantic.color.accent}",
            "width": "{border.width.standard}"
          }
        },
        "thumb": {
          "radius": "{radius.sm}"
        }
      },
      "states": {
        "hover": {
          "root": {
            "border": {
              "color": "{semantic.color.focus}",
              "width": "{border.width.standard}"
            }
          }
        },
        "pressed": {
          "root": {
            "border": {
              "color": "{semantic.color.focus}",
              "width": "{border.width.standard}"
            }
          }
        },
        "checked": {
          "root": {
            "border": {
              "color": "{semantic.color.focus}",
              "width": "{border.width.standard}"
            }
          }
        }
      }
    },
    "table": {
      "base": {
        "root": {
          "fill": "{semantic.color.surface}",
          "radius": "{radius.sm}",
          "border": {
            "color": "{semantic.color.accent}",
            "width": "{border.width.standard}"
          }
        },
        "header": {
          "fill": "{semantic.color.surfaceElevated}"
        }
      }
    },
    "tabs": {
      "base": {
        "tabList": {
          "border": {
            "color": "{semantic.color.focus}",
            "width": "{border.width.standard}"
          }
        }
      }
    },
    "toast": {
      "base": {
        "root": {
          "fill": "{semantic.color.background}"
        }
      }
    },
    "tooltip": {
      "base": {
        "popup": {
          "fill": "{semantic.color.background}",
          "border": {
            "color": "{semantic.color.focus}",
            "width": "{border.width.standard}"
          }
        }
      }
    },
    "tree": {
      "base": {
        "root": {
          "radius": "{radius.sm}",
          "border": {
            "color": "{semantic.color.accent}",
            "width": "{border.width.standard}"
          }
        },
        "item": {
          "radius": "{radius.sm}"
        }
      }
    }
  }
}
